{
  "schemaVersion": 1,
  "rulesVersion": "standard-decks-v1",
  "deckSetVersion": "2026-08-08",
  "primaryCheckpoint": "humanities-standard-final9",
  "checkpoints": [
    {
      "id": "morality-leadership-reroll-core7",
      "name": "7레벨 리롤 핵심",
      "phase": "core",
      "boardLevel": 7
    },
    {
      "id": "morality-leadership-reroll-final8",
      "name": "8레벨 리롤 최종",
      "phase": "final",
      "boardLevel": 8
    },
    {
      "id": "prank-reroll-core7",
      "name": "7레벨 리롤 핵심",
      "phase": "core",
      "boardLevel": 7
    },
    {
      "id": "prank-reroll-final8",
      "name": "8레벨 리롤 최종",
      "phase": "final",
      "boardLevel": 8
    },
    {
      "id": "health-reroll-core7",
      "name": "7레벨 리롤 핵심",
      "phase": "core",
      "boardLevel": 7
    },
    {
      "id": "health-reroll-final8",
      "name": "8레벨 리롤 최종",
      "phase": "final",
      "boardLevel": 8
    },
    {
      "id": "arts-reroll-core7",
      "name": "7레벨 리롤 핵심",
      "phase": "core",
      "boardLevel": 7
    },
    {
      "id": "arts-reroll-final8",
      "name": "8레벨 리롤 최종",
      "phase": "final",
      "boardLevel": 8
    },
    {
      "id": "morality-vertical-reroll-core7",
      "name": "7레벨 리롤 핵심",
      "phase": "core",
      "boardLevel": 7
    },
    {
      "id": "morality-vertical-reroll-final8",
      "name": "8레벨 리롤 최종",
      "phase": "final",
      "boardLevel": 8
    },
    {
      "id": "leadership-vertical-reroll-core7",
      "name": "7레벨 리롤 핵심",
      "phase": "core",
      "boardLevel": 7
    },
    {
      "id": "leadership-vertical-reroll-final8",
      "name": "8레벨 리롤 최종",
      "phase": "final",
      "boardLevel": 8
    },
    {
      "id": "morality-leadership-standard-core8",
      "name": "8레벨 운영 핵심",
      "phase": "core",
      "boardLevel": 8
    },
    {
      "id": "morality-leadership-standard-final9",
      "name": "9레벨 운영 최종",
      "phase": "final",
      "boardLevel": 9
    },
    {
      "id": "humanities-standard-core8",
      "name": "8레벨 운영 핵심",
      "phase": "core",
      "boardLevel": 8
    },
    {
      "id": "humanities-standard-final9",
      "name": "9레벨 운영 최종",
      "phase": "final",
      "boardLevel": 9
    },
    {
      "id": "stem-standard-core8",
      "name": "8레벨 운영 핵심",
      "phase": "core",
      "boardLevel": 8
    },
    {
      "id": "stem-standard-final9",
      "name": "9레벨 운영 최종",
      "phase": "final",
      "boardLevel": 9
    },
    {
      "id": "capitalism-standard-core8",
      "name": "8레벨 운영 핵심",
      "phase": "core",
      "boardLevel": 8
    },
    {
      "id": "capitalism-standard-final9",
      "name": "9레벨 운영 최종",
      "phase": "final",
      "boardLevel": 9
    },
    {
      "id": "broadcast-vertical-standard-core8",
      "name": "8레벨 운영 핵심",
      "phase": "core",
      "boardLevel": 8
    },
    {
      "id": "broadcast-vertical-standard-final9",
      "name": "9레벨 운영 최종",
      "phase": "final",
      "boardLevel": 9
    },
    {
      "id": "health-vertical-standard-core8",
      "name": "8레벨 운영 핵심",
      "phase": "core",
      "boardLevel": 8
    },
    {
      "id": "health-vertical-standard-final9",
      "name": "9레벨 운영 최종",
      "phase": "final",
      "boardLevel": 9
    },
    {
      "id": "morality-leadership-highvalue-final9",
      "name": "9레벨 고밸류",
      "phase": "final",
      "boardLevel": 9
    },
    {
      "id": "broadcast-highvalue-final9",
      "name": "9레벨 고밸류",
      "phase": "final",
      "boardLevel": 9
    },
    {
      "id": "athletics-highvalue-final9",
      "name": "9레벨 고밸류",
      "phase": "final",
      "boardLevel": 9
    },
    {
      "id": "cafeteria-highvalue-final9",
      "name": "9레벨 고밸류",
      "phase": "final",
      "boardLevel": 9
    },
    {
      "id": "prank-highvalue-final9",
      "name": "9레벨 고밸류",
      "phase": "final",
      "boardLevel": 9
    },
    {
      "id": "health-highvalue-final9",
      "name": "9레벨 고밸류",
      "phase": "final",
      "boardLevel": 9
    },
    {
      "id": "humanities-highvalue-final9",
      "name": "9레벨 고밸류",
      "phase": "final",
      "boardLevel": 9
    },
    {
      "id": "stem-highvalue-final9",
      "name": "9레벨 고밸류",
      "phase": "final",
      "boardLevel": 9
    },
    {
      "id": "arts-highvalue-final9",
      "name": "9레벨 고밸류",
      "phase": "final",
      "boardLevel": 9
    },
    {
      "id": "creative-highvalue-final9",
      "name": "9레벨 고밸류",
      "phase": "final",
      "boardLevel": 9
    },
    {
      "id": "cafeteria-vertical-highvalue-final9",
      "name": "9레벨 고밸류",
      "phase": "final",
      "boardLevel": 9
    },
    {
      "id": "leadership-vertical-highvalue-final9",
      "name": "9레벨 고밸류",
      "phase": "final",
      "boardLevel": 9
    },
    {
      "id": "athletics-vertical-highvalue-final9",
      "name": "9레벨 고밸류",
      "phase": "final",
      "boardLevel": 9
    },
    {
      "id": "prank-vertical-highvalue-final9",
      "name": "9레벨 고밸류",
      "phase": "final",
      "boardLevel": 9
    }
  ],
  "decks": [
    {
      "id": "morality-leadership-reroll-core7",
      "name": "도덕 선도부 리롤 core7",
      "strategyGroup": "reroll_core7",
      "checkpointId": "morality-leadership-reroll-core7",
      "sourceLegacyIds": [
        "legacy-001"
      ],
      "migrationStatus": "modified",
      "changeReason": "3코스트 양호실 도우미와 올림피아드 금상을 핵심 탱커·딜러로 재지정했다.",
      "units": [
        {
          "unitId": "u1_1",
          "star": 2,
          "items": [],
          "position": 4,
          "positionGroup": "front-side"
        },
        {
          "unitId": "u2_10",
          "star": 2,
          "items": [],
          "position": 1,
          "positionGroup": "front-side"
        },
        {
          "unitId": "u3_1",
          "star": 3,
          "items": [
            "comb_ad_ad",
            "comb_ad_as",
            "comb_ad_crit"
          ],
          "position": 20,
          "positionGroup": "back-center"
        },
        {
          "unitId": "u2_2",
          "star": 2,
          "items": [],
          "position": 6,
          "positionGroup": "front-side"
        },
        {
          "unitId": "u3_2",
          "star": 3,
          "items": [
            "comb_hp_hp",
            "comb_armor_armor",
            "comb_armor_mr"
          ],
          "position": 3,
          "positionGroup": "front-center"
        },
        {
          "unitId": "u1_10",
          "star": 2,
          "items": [],
          "position": 11,
          "positionGroup": "mid-side"
        },
        {
          "unitId": "u4_1",
          "star": 1,
          "items": [],
          "position": 18,
          "positionGroup": "back-side"
        }
      ],
      "fixedItems": true,
      "roles": {
        "mainTank": "u3_2",
        "mainDealer": "u3_1",
        "subDealer": "u4_1"
      },
      "expectedSynergies": [
        {
          "type": "subjects",
          "name": "도덕",
          "level": 4
        },
        {
          "type": "subjects",
          "name": "체육",
          "level": 2
        },
        {
          "type": "clubs",
          "name": "선도부",
          "level": 4
        },
        {
          "type": "clubs",
          "name": "보건부",
          "level": 2
        }
      ],
      "defaultItemSet": "baseline6",
      "tags": [
        "도덕선도 코어",
        "reroll_core7"
      ],
      "notes": "도덕선도 코어 Lv.7 감사 결과에서 이관"
    },
    {
      "id": "morality-leadership-reroll-final8",
      "name": "도덕 선도부 리롤 final8",
      "strategyGroup": "reroll_final8",
      "checkpointId": "morality-leadership-reroll-final8",
      "parentDeckId": "morality-leadership-reroll-core7",
      "sourceLegacyIds": [
        "legacy-001"
      ],
      "migrationStatus": "new-design",
      "changeReason": "core7 핵심 3코스트 3성 쌍을 유지하고 천재 퀀트 2성으로 수학 2와 보조 화력을 확보했다.",
      "units": [
        {
          "unitId": "u1_1",
          "star": 2,
          "items": [],
          "position": 4,
          "positionGroup": "front-side"
        },
        {
          "unitId": "u2_10",
          "star": 2,
          "items": [],
          "position": 1,
          "positionGroup": "front-side"
        },
        {
          "unitId": "u3_1",
          "star": 3,
          "items": [
            "comb_ad_ad",
            "comb_ad_as",
            "comb_ad_crit"
          ],
          "position": 20,
          "positionGroup": "back-center"
        },
        {
          "unitId": "u2_2",
          "star": 2,
          "items": [],
          "position": 6,
          "positionGroup": "front-side"
        },
        {
          "unitId": "u3_2",
          "star": 3,
          "items": [
            "comb_hp_hp",
            "comb_armor_armor",
            "comb_armor_mr"
          ],
          "position": 3,
          "positionGroup": "front-center"
        },
        {
          "unitId": "u1_10",
          "star": 2,
          "items": [],
          "position": 11,
          "positionGroup": "mid-side"
        },
        {
          "unitId": "u4_1",
          "star": 2,
          "items": [],
          "position": 12,
          "positionGroup": "mid-side"
        },
        {
          "unitId": "u4_8",
          "star": 2,
          "items": [],
          "position": 18,
          "positionGroup": "back-side"
        }
      ],
      "fixedItems": true,
      "roles": {
        "mainTank": "u3_2",
        "mainDealer": "u3_1",
        "subDealer": "u4_8"
      },
      "expectedSynergies": [
        {
          "type": "subjects",
          "name": "도덕",
          "level": 4
        },
        {
          "type": "subjects",
          "name": "수학",
          "level": 2
        },
        {
          "type": "subjects",
          "name": "체육",
          "level": 2
        },
        {
          "type": "clubs",
          "name": "선도부",
          "level": 4
        },
        {
          "type": "clubs",
          "name": "보건부",
          "level": 2
        }
      ],